{
  "schema_version": "home-tutor.tutor-content.v1",
  "session_id": "a1000001-0001-4001-8001-000000000001",
  "question_id": "q06",
  "analysis_status": "ready",
  "verdict": "wrong",
  "reference_answer": "25",
  "summary": "规律数错了",
  "explanation_paragraphs": [
    "第 6 题你的答案是：21。",
    "再数一数每层新增的小正方形。",
    "正确答案是：25。"
  ],
  "error_classification": {
    "category": "concept_error",
    "subcategory": "sequence_pattern",
    "confidence": 0.88
  },
  "process_comment": "这道题你写了大约 4 分钟，中间停笔较久，说明在认真想。",
  "actions": [
    {
      "id": "explain_more",
      "label": "详细讲讲",
      "enabled": false
    }
  ],
  "stale": false,
  "generated_at": "2026-06-30T09:42:38.000Z",
  "model": "mock-v2",
  "error": null
}