{
  "schema_version": "home-tutor.tutor-content.v1",
  "session_id": "a1000000-0000-4000-8000-000000000000",
  "question_id": "q30",
  "analysis_status": "ready",
  "verdict": "wrong",
  "reference_answer": "B15% D35% 共400人",
  "summary": "总人数估错了",
  "explanation_paragraphs": [
    "第 30 题你的答案是：总人数300；B20% D30%。",
    "把已知百分数和件数对应起来列方程。",
    "正确答案是：B15% D35% 共400人。"
  ],
  "error_classification": {
    "category": "concept_error",
    "subcategory": "percentage_table",
    "confidence": 0.88
  },
  "process_comment": "这道题你写了大约 5 分钟，中间停笔较久，说明在认真想。",
  "actions": [
    {
      "id": "explain_more",
      "label": "详细讲讲",
      "enabled": false
    }
  ],
  "stale": false,
  "generated_at": "2026-06-30T09:42:37.000Z",
  "model": "mock-v2",
  "error": null
}