{
  "schema_version": "home-tutor.tutor-content.v1",
  "session_id": "b2000002-0002-4002-8002-000000000002",
  "question_id": "q28",
  "analysis_status": "ready",
  "verdict": "wrong",
  "reference_answer": "①6962.5m²  ②357m  ③7.536m",
  "summary": "这题还有提升空间",
  "explanation_paragraphs": [
    "第 28 题你的答案是：① 6500m²  ② 400m  ③ 3.14m。",
    "正确答案是：①6962.5m²  ②357m  ③7.536m。",
    "回忆一下本题用到的知识点，再练一道类似的。"
  ],
  "error_classification": {
    "category": "unknown",
    "confidence": 0.6
  },
  "process_comment": "这道题你写了大约 4 分钟，中间停笔较久，说明在认真想。",
  "actions": [
    {
      "id": "explain_more",
      "label": "详细讲讲",
      "enabled": false
    }
  ],
  "stale": false,
  "generated_at": "2026-06-30T09:42:38.000Z",
  "model": "mock-v2",
  "error": null
}