{
  "schema_version": "home-tutor.tutor-content.v1",
  "session_id": "a1000002-0002-4002-8002-000000000002",
  "question_id": "q03",
  "analysis_status": "ready",
  "verdict": "wrong",
  "reference_answer": "36；72",
  "summary": "注意比例分配：顶角:底角=1:2，三角形内角和180°。",
  "explanation_paragraphs": [
    "设顶角为x，底角为2x，则x+2x+2x=180°，解得x=36°。",
    "所以顶角是36°，每个底角是72°。",
    "你算出的45°和67.5°比例不对哦，再检查一下。"
  ],
  "actions": [
    {
      "id": "explain_more",
      "label": "详细讲讲",
      "enabled": true
    },
    {
      "id": "give_hint",
      "label": "给个提示",
      "enabled": true
    }
  ],
  "stale": false,
  "generated_at": "2026-07-06T02:33:04.003687Z",
  "model": "deepseek-v4-flash",
  "error": null,
  "process_comment": "你一次就写下了答案，没有修改，但答案错了。建议先设未知数列方程，再求解。加油！",
  "error_classification": {
    "category": "calculation_error",
    "subcategory": "比例计算错误",
    "confidence": 0.9
  }
}