{
  "schema_version": "home-tutor.tutor-content.v1",
  "session_id": "c3000001-0001-4001-8001-000000000001",
  "question_id": "q05",
  "analysis_status": "ready",
  "verdict": "correct",
  "reference_answer": "425；400",
  "summary": "正确算出出粉率问题",
  "explanation_paragraphs": [
    "出粉率85%表示每100千克小麦能磨85千克面粉。",
    "第一问：500千克小麦磨面粉，500×85%=425千克。",
    "第二问：340千克面粉需小麦，340÷85%=400千克。"
  ],
  "actions": [
    {
      "id": "explain_more",
      "label": "详细讲讲",
      "enabled": true
    },
    {
      "id": "give_hint",
      "label": "给个提示",
      "enabled": true
    }
  ],
  "stale": false,
  "generated_at": "2026-07-06T02:43:19.661493Z",
  "model": "deepseek-v4-flash",
  "error": null,
  "process_comment": "你快速准确地写下了答案，没有修改或犹豫，说明对出粉率很熟悉！"
}