{
  "schema_version": "home-tutor.tutor-content.v1",
  "session_id": "b2000001-0001-4001-8001-000000000001",
  "question_id": "q06",
  "analysis_status": "ready",
  "verdict": "wrong",
  "reference_answer": "25",
  "summary": "这题还有提升空间",
  "explanation_paragraphs": [
    "第 6 题你的答案是：19。",
    "正确答案是：25。",
    "回忆一下本题用到的知识点，再练一道类似的。"
  ],
  "error_classification": {
    "category": "unknown",
    "confidence": 0.6
  },
  "process_comment": "这道题你写了大约 4 分钟，中间停笔较久，说明在认真想。",
  "actions": [
    {
      "id": "explain_more",
      "label": "详细讲讲",
      "enabled": false
    }
  ],
  "stale": false,
  "generated_at": "2026-06-30T09:42:38.000Z",
  "model": "mock-v2",
  "error": null
}